"id","title","q1","q2","q3","q4","answer","test_id"
1,Каким по счёту Иваном был Иван Грозный в череде русских правителей?,I,II,III,IV,IV,1
2,"Считается, что причиной жестокости Ивана Грозного было...",Раннее вступление на престол,Наблюдение в детстве за жестокими схватками между боярами вокруг престола,Недостаток поддержки царя среди армии и дворянства,Постоянные народные восстания,Наблюдение в детстве за жестокими схватками между боярами вокруг престола,1
3,Во времена Ивана Грозного были значительно расширены восточные русские границы. Благодаря завоеванию каких ханств это произошло?,Хивинского и Бухарского,Половецкого и Хазарского,Казанского и Астраханского,Калмыцкого и Джунгарского,Казанского и Астраханского,1
4,В 1575 году Иван Грозный на год уступил свой титул «великого князя всея Руси» одному из своих сподвижников. Как его звали?,Андрей Курбский,Симеон Бекбулатович,Малюта Скуратов,Даниил Адашев,Симеон Бекбулатович,1
5,"Сохранилась переписка Ивана Грозного с этой английской королевой, по слухам, он даже к ней сватался. Как её звали?",Мария I,Матильда,Анна,Елизавета I,Елизавета I,1
6,"Считается, что этого своего сына Иван Грозный убил собственноручно, в припадке ярости",Ивана,Фёдора,Дмитрия,Василия,Ивана,1
7,"Кто из русских поэтов является автором поэтического цикла ""Стихи о Прекрасной Даме""?",А А Блок,С А Есенин,М И Цветаева,А А Ахматова,А А Блок,2
8,"Из какого стихотворения Н. Заболоцкого эти философские строки?  Что есть красота? И почему ее обожествляют люди?  Сосуд она, в котором пустота,  Или огонь, мерцающий в сосуде?",Воспоминание,в Кино,Гроза,Некрасивая девочка,Некрасивая девочка,2
9,"Укажите термин, обозначающий исторически сложившуюся, устойчивую разновидность художественного произведения.","Укажите термин, обозначающий исторически сложившуюся, устойчивую разновидность художественного произведения.",конфликт,диалог,жанр,жанр,2